{"columns":["o","d","trips"],"note":"top 600 directed pairs, o != d, by annual trips","rows":[[237,236,387897],[236,237,353959],[138,230,294588],[216,132,292890],[230,138,259490],[36,37,233254],[255,112,231882],[37,36,223413],[112,255,216536],[237,161,207609],[161,237,202101],[132,230,201992],[215,130,198892],[7,223,194867],[41,42,177772],[223,7,175195],[188,61,175162],[225,61,172823],[161,138,172406],[74,75,171225],[239,142,171205],[61,225,170867],[42,41,168976],[75,74,168131],[255,256,166942],[61,188,166625],[142,239,161356],[161,236,160951],[141,236,160737],[236,161,159414],[237,162,158824],[39,76,158810],[138,164,157409],[35,76,156294],[130,215,155817],[138,161,155396],[239,238,154960],[256,255,154657],[249,79,154363],[161,164,154147],[129,82,153663],[36,198,152863],[161,234,152085],[230,132,151451],[61,17,150404],[17,61,150268],[48,68,150081],[238,239,149399],[76,35,148719],[230,68,148428],[82,129,148005],[230,246,147549],[48,246,147488],[230,186,144762],[234,170,144406],[7,179,143193],[77,76,143081],[112,145,142829],[164,138,142252],[37,225,142103],[236,141,141313],[198,36,140620],[76,39,140241],[79,249,140163],[68,230,140095],[42,74,139982],[138,162,139154],[179,7,138108],[79,148,138034],[76,77,137899],[145,112,137636],[141,237,137545],[243,244,137076],[225,37,136719],[68,246,136456],[164,161,136196],[148,79,135904],[246,48,135443],[74,42,134816],[244,243,134184],[246,230,133942],[249,231,133865],[162,138,133782],[255,80,133342],[239,236,132813],[237,141,132616],[142,237,132068],[164,230,131820],[161,230,131196],[197,216,130870],[186,230,130779],[234,68,129935],[236,239,129672],[225,17,129617],[80,255,128580],[237,142,128151],[163,161,127720],[80,112,127650],[162,237,127577],[17,225,126692],[41,74,126107],[234,246,125857],[231,249,125780],[14,228,125176],[68,234,124578],[161,186,124438],[216,197,124107],[161,170,123890],[205,130,123865],[74,41,123837],[263,236,123677],[68,48,123558],[142,236,123106],[163,138,122896],[79,107,122853],[142,161,122826],[91,89,122578],[37,198,122229],[107,170,121951],[161,68,121513],[236,142,121512],[79,170,121383],[140,236,121051],[228,14,121030],[170,234,120901],[80,37,120731],[256,112,120571],[10,130,120522],[63,76,120464],[163,237,120374],[76,63,119835],[142,238,119737],[132,164,119470],[161,163,119266],[234,161,118970],[236,238,118754],[226,7,118647],[234,249,118558],[198,37,118437],[246,68,118348],[237,263,117944],[170,138,117641],[262,236,117522],[234,79,117307],[230,164,116888],[237,140,116683],[112,80,116378],[186,161,115991],[236,162,115705],[112,256,115665],[238,236,115553],[37,80,115080],[138,163,114726],[249,234,114615],[246,234,114474],[72,61,113617],[230,161,113300],[170,161,113108],[249,68,112982],[163,230,112861],[237,163,112120],[37,61,111907],[236,140,111874],[238,142,111599],[90,246,111576],[163,236,111436],[91,39,111375],[138,48,111128],[7,226,110374],[186,170,110369],[181,61,110335],[138,170,110191],[140,237,109971],[132,48,109829],[35,61,109678],[37,17,109407],[161,246,109403],[263,141,109117],[229,237,109059],[216,130,108742],[107,79,108691],[230,163,108361],[236,75,108264],[42,116,108213],[36,225,107514],[164,246,107321],[17,37,106914],[143,239,106670],[68,170,106611],[161,142,106574],[162,236,106440],[142,230,106398],[61,37,106183],[142,163,105864],[161,48,105606],[79,114,105376],[79,234,105347],[132,216,105338],[138,68,104526],[246,164,104494],[142,48,104480],[62,61,104470],[161,141,104464],[177,61,104170],[236,263,104163],[231,246,104032],[68,249,104026],[114,79,103944],[39,72,103930],[48,161,103816],[141,162,103480],[236,262,103461],[129,7,103426],[68,161,103416],[89,188,103361],[164,68,102845],[234,230,102586],[17,217,102582],[72,39,102472],[230,142,102332],[129,260,102244],[145,7,102139],[263,237,102112],[79,68,101882],[170,186,101817],[234,186,101620],[48,138,101567],[239,237,101533],[89,91,101334],[249,246,101305],[246,231,101223],[61,181,101021],[170,79,100948],[130,205,100871],[225,36,100835],[130,10,100771],[230,170,100613],[141,263,100369],[239,143,100340],[164,132,100257],[230,1,100165],[188,89,99732],[68,164,99730],[90,68,99249],[164,234,99093],[7,129,99092],[61,35,99034],[39,91,99010],[48,230,98911],[168,159,98791],[144,79,98629],[237,229,98577],[141,161,98576],[145,226,98301],[79,186,98279],[164,170,97952],[140,162,97880],[162,141,97441],[231,79,97402],[237,239,97335],[230,48,97280],[162,230,97184],[255,37,97152],[61,177,97135],[35,72,96879],[79,144,96833],[159,168,96669],[256,80,96544],[68,138,96492],[246,249,96340],[231,158,96269],[7,260,95928],[48,142,95909],[186,234,95818],[79,231,95791],[158,231,95682],[236,163,95599],[72,35,94954],[162,170,94945],[186,246,94885],[234,231,94857],[170,230,94740],[80,256,94516],[61,62,94510],[25,181,94416],[249,170,94027],[61,72,93996],[196,95,93989],[246,161,93744],[10,132,93716],[246,186,93441],[263,75,93372],[116,244,92644],[170,68,92357],[89,71,92084],[163,142,91843],[226,145,91746],[116,42,91664],[170,107,91426],[262,237,91200],[68,79,91183],[102,198,91064],[130,216,90739],[234,164,90532],[92,171,90058],[230,162,89920],[228,227,89818],[170,162,89813],[49,61,89806],[71,188,89771],[161,229,89583],[231,87,89558],[171,92,89546],[90,249,89439],[79,137,89350],[231,234,89285],[188,62,89217],[56,82,89212],[197,130,88997],[227,228,88647],[7,145,88560],[230,50,88551],[162,161,88511],[41,166,88357],[161,162,88123],[249,107,88099],[249,90,87885],[228,181,87603],[163,162,87506],[229,161,87448],[35,177,86761],[162,234,86755],[107,186,86713],[260,7,86696],[226,260,86465],[140,263,86387],[71,89,86357],[237,262,86208],[249,144,86145],[163,246,86109],[256,37,86060],[260,129,85994],[230,234,85957],[217,17,85785],[246,90,85757],[239,163,85553],[100,230,85334],[238,166,85303],[42,244,85234],[97,61,85181],[162,186,85028],[61,49,84982],[97,49,84978],[198,102,84969],[162,140,84856],[37,255,84655],[231,148,84572],[48,132,84522],[132,68,84437],[143,142,84375],[181,228,84019],[69,247,83954],[170,237,83929],[161,107,83821],[79,164,83759],[28,130,83611],[141,229,83580],[246,163,83460],[7,138,83417],[107,162,83334],[72,188,83268],[163,164,83171],[14,67,82933],[95,196,82925],[48,186,82919],[129,138,82858],[48,163,82756],[161,79,82705],[237,230,82565],[144,231,82556],[142,143,82445],[68,231,82427],[132,10,82425],[138,233,82325],[67,14,82320],[229,140,82313],[113,79,82290],[62,188,82183],[117,86,82082],[163,68,81967],[188,71,81767],[138,100,81747],[144,249,81584],[249,148,81448],[256,17,81425],[91,155,81339],[244,116,81266],[239,161,81194],[100,161,81139],[114,231,81093],[231,68,81002],[161,132,80977],[164,79,80964],[138,79,80820],[246,158,80776],[82,56,80758],[107,249,80650],[229,162,80632],[233,138,80422],[162,164,80330],[145,138,80267],[13,231,80252],[79,138,80134],[51,81,80133],[132,163,80132],[260,226,80088],[239,230,80034],[82,260,80012],[141,140,79878],[231,144,79867],[68,163,79819],[260,82,79602],[181,89,79543],[237,170,79524],[158,246,79479],[263,140,79376],[100,138,79361],[186,107,79359],[68,90,79282],[148,231,79280],[164,48,79156],[231,211,79156],[229,141,79142],[137,79,79086],[130,28,79060],[186,79,79059],[247,69,79046],[89,85,78820],[221,206,78810],[132,170,78776],[79,162,78703],[48,170,78694],[36,80,78690],[86,117,78671],[239,151,78598],[249,186,78582],[151,239,78531],[163,170,78530],[132,138,78439],[170,132,78326],[83,82,78261],[48,164,78143],[161,249,77852],[79,90,77850],[87,231,77612],[48,239,77582],[167,159,77505],[230,239,77349],[162,107,77348],[80,36,77344],[75,41,77248],[230,237,77246],[231,114,77222],[107,68,77175],[17,49,77069],[41,75,76933],[138,87,76753],[61,97,76721],[17,256,76608],[68,50,76564],[68,186,76485],[243,127,76395],[255,138,76392],[48,50,76354],[162,68,76283],[186,48,76189],[49,97,76117],[188,72,76099],[164,163,75946],[18,174,75902],[163,239,75875],[234,114,75858],[132,161,75747],[76,132,75729],[181,25,75729],[161,233,75706],[163,132,75702],[163,48,75615],[161,239,75523],[231,13,75506],[42,168,75476],[143,238,75387],[239,48,75258],[127,243,75227],[42,75,75191],[130,197,75188],[177,35,75166],[244,42,75078],[163,186,74975],[254,259,74873],[237,238,74713],[79,211,74706],[170,229,74627],[213,212,74568],[90,79,74561],[211,79,74558],[112,37,74493],[61,132,74481],[148,249,74477],[85,89,74406],[138,255,74265],[49,17,74233],[107,161,74193],[75,236,74185],[87,138,74185],[246,170,74133],[90,170,74115],[70,138,74021],[162,163,73977],[79,113,73969],[229,236,73933],[61,76,73799],[262,140,73717],[249,164,73568],[247,119,73562],[50,246,73516],[72,76,73278],[97,17,73215],[100,246,73162],[234,158,73161],[50,68,73113],[233,161,73003],[161,231,72912],[249,211,72908],[140,141,72883],[75,42,72789],[68,132,72610],[170,164,72462],[35,39,72459],[142,162,72458],[164,162,72433],[212,213,72424],[141,138,72382],[50,230,72008],[82,83,71981],[161,100,71969],[263,138,71955],[37,112,71842],[234,113,71755],[39,35,71710],[113,231,71620],[114,249,71619],[236,138,71583],[254,81,71579],[220,200,71566],[107,138,71540],[138,90,71351],[132,255,71345],[140,229,71319],[181,189,71288],[211,231,71238],[89,181,71127],[186,68,71060],[222,76,71049],[74,168,71021],[138,145,70956],[170,249,70934],[163,234,70905],[132,162,70790],[70,129,70629],[148,107,70484],[230,100,70484],[249,114,70460],[161,140,70308],[138,107,70220],[255,132,70190],[238,237,70160],[138,132,70158],[234,138,70154],[168,42,70136],[238,143,70135],[234,162,69871],[254,174,69849],[37,256,69710],[142,68,69670],[229,170,69541],[140,262,69527],[71,72,69422],[223,179,69410],[79,87,69273],[132,61,69056],[143,163,68994],[211,249,68910],[68,107,68857],[138,186,68788],[158,234,68642],[177,76,68567],[43,161,68524],[107,234,68517],[234,48,68436]],"schema_version":"v1","tags":{"trips":"OBSERVED"}}
